[
  {
    "cityId": "10000000-0000-0000-0000-000000000001",
    "zoneId": "20000000-0000-0000-0000-000000000001",
    "sourceId": "40000000-0000-0000-0000-000000000001",
    "externalId": "sample-import-1",
    "kind": "demand",
    "commodity": "rice",
    "quantity": 10,
    "unit": "kg",
    "observedAt": "2026-01-01T00:00:00Z",
    "periodEnd": "2026-01-01T01:00:00Z"
  },
  {
    "cityId": "10000000-0000-0000-0000-000000000001",
    "zoneId": "20000000-0000-0000-0000-000000000001",
    "sourceId": "40000000-0000-0000-0000-000000000001",
    "externalId": "sample-import-2",
    "kind": "demand",
    "commodity": "rice",
    "quantity": 20,
    "unit": "kg",
    "observedAt": "2026-01-01T01:00:00Z",
    "periodEnd": "2026-01-01T02:00:00Z"
  },
  {
    "cityId": "10000000-0000-0000-0000-000000000001",
    "zoneId": "20000000-0000-0000-0000-000000000001",
    "sourceId": "40000000-0000-0000-0000-000000000001",
    "externalId": "sample-import-3",
    "kind": "demand",
    "commodity": "rice",
    "quantity": 30,
    "unit": "kg",
    "observedAt": "2026-01-01T02:00:00Z",
    "periodEnd": "2026-01-01T03:00:00Z"
  }
]
